{
  "schema_version": 1,
  "attempt_id": "11111111-1111-4111-8111-111111111111",
  "sha": "aaaaaaaaaaaaaaaaaaaaaaaaaaaaaaaaaaaaaaaa",
  "current_boot_id": "22222222-2222-4222-8222-222222222222",
  "boot_changed": false,
  "user_fix_intent_relative_path": "user-fix-intent.json",
  "user_fix_intent_sha256": "bbbbbbbbbbbbbbbbbbbbbbbbbbbbbbbbbbbbbbbbbbbbbbbbbbbbbbbbbbbbbbbb",
  "terminal_revalidation_relative_path": "terminal-revalidation/22222222-2222-4222-8222-222222222222.json",
  "terminal_revalidation_sha256": "cccccccccccccccccccccccccccccccccccccccccccccccccccccccccccccccc",
  "approvals_sha256": "dddddddddddddddddddddddddddddddddddddddddddddddddddddddddddddddd"
}
